{
  "created_at": "2026-09-10T18:24:08Z",
  "payload_hash_scope": "related_records_canonical_json",
  "payload_sha256": "794cb2002c652d7022ad7ca4eab9c349575b162d2ba7199fe384432d3d0f8848",
  "receipt_id": "rcp_m7houseroberts2026091001",
  "receipt_type": "contribution",
  "related_record_ids": [
    "clm_46f71b753dd5a51e961ec6df",
    "clm_4895dac9d99f17dc7737aae8",
    "clm_4b07160062124fd0a550d66d",
    "clm_5331d0c7c8d821bd1c38dbfd",
    "clm_61908f7c6ef0b5081a7d0b86",
    "clm_6587be1e5f5281209b71e32f",
    "clm_6974a88ce5d2afad27b63ece",
    "clm_6a1915da2622feb109386602",
    "clm_72d9b8c563c53c1d61c2c520",
    "clm_919f909750542ddfad4c31c2",
    "clm_9bb514c6e8d13fadc66857f2",
    "clm_aa0e6cb8788134c8f514b6ae",
    "clm_b142f3a943e858ea4542b9fb",
    "clm_c0cbb7084ee56a37df11442a",
    "clm_c955ecfdc92911611af8af74",
    "clm_ec8afb8224797de2719059d7",
    "clm_fdcd9b131afdc5ce1dd0b550",
    "ent_089ced07950ace8407a29247",
    "ent_2beedf6ea02e8ba696464bb3",
    "ent_6ca283919bf4d6fa26a0da9f",
    "ent_6dd97bc94c6fe241d0bb1a0e",
    "ent_7ea2ae660f60d58012dcb3a7",
    "ent_87a65ae57efbb95fe75d068c",
    "ent_d1b3b818dfa863a35aab7680",
    "ent_d3de309d4578b75dc73ee5f2",
    "evd_43cf07ba816dbe19d270d124",
    "evd_db435362e5eb93eba7f3eac4"
  ],
  "safe_summary": "Bounded House Roberts pilot from cited public guides. These are unobserved historical claims; source integrity is not factual, version or legal certification. Original v1.0.0 records and receipt remain unchanged.",
  "schema_version": "pywel.receipt.v1",
  "state": "accepted"
}
