{
  "created_at": "2026-09-13T06:51:00Z",
  "payload_hash_scope": "related_records_canonical_json",
  "payload_sha256": "2b56bd6d4d19cc07c17defaf9a9453516d679f1580fabb64fae1b26f95f97fe7",
  "receipt_id": "rcp_s06rewarditems2026091301",
  "receipt_type": "contribution",
  "related_record_ids": [
    "clm_s0600047899711850eee2af3a1e",
    "clm_s06070212f364b0298ab9d695e3",
    "clm_s060752d3b916e755aa96d29e5c",
    "clm_s060c648c5935eec042240fa91d",
    "clm_s0618009b16bd5ddbef944a4d9b",
    "clm_s061fc92d4a942524b2630ac6e1",
    "clm_s06239c6338ef8111623594013c",
    "clm_s0629237f67e7dbffd46dee8c23",
    "clm_s062de93db0a39f9633f11d6343",
    "clm_s0634c9fcb36c75291c7ca1c82b",
    "clm_s06397f2456b12e12cb1b7193e1",
    "clm_s063b9dbf43f3f7faca03bb8a71",
    "clm_s065c01a77bf9d277d48c6fb531",
    "clm_s066498317ce5df8df26d576faa",
    "clm_s06698b910fff19af85961de0ea",
    "clm_s066ecb42ae6fbc91cb31f0b1f4",
    "clm_s067d198cfa7bf80645030cc0dc",
    "clm_s068ae1ceb733430858030ae870",
    "clm_s0692ffbaddab1a75506f514648",
    "clm_s069b24158e2c0196a13cb5473c",
    "clm_s06b1c4efa2d0fabd057a051c75",
    "clm_s06b886e21fcb6578f51da690ba",
    "clm_s06c04ca76347bb857340e2237a",
    "clm_s06c5a3b883998569c84c640040",
    "clm_s06cef7308e78bfab50ee454558",
    "clm_s06cf8b85a475d440807eba26ff",
    "clm_s06d350f4bd48eeb1f12f05d4f2",
    "clm_s06d5f226c8e7ad8666ca6704cb",
    "clm_s06e26649e3e3040277be7ee946",
    "ent_s06274200a35a7a210c5fd2effb",
    "ent_s0655d5d65afa51db115caa3451",
    "ent_s0658db1bb45b8834852dc0b9ac",
    "ent_s065e0f5772b87fa02b46877d78",
    "ent_s0663f9700b46a161c3db7bdcc8",
    "ent_s06672bbadacb74201b0570e22f",
    "ent_s066ab492fa61295f7acd901dbf",
    "ent_s066f5618f4abefdabb27d1ecb3",
    "ent_s067109e592955d54490ece7314",
    "ent_s06725cea1614500cdd91752470",
    "ent_s067e09d551c0cf8cc0f104cd02",
    "ent_s06a5e6606bc7e3941dfe1a7571",
    "ent_s06b8da0e5737edf4f80c6bd8ab",
    "ent_s06b99d73e799543286604afbd9",
    "ent_s06c11545ff0a8839951c8e810f",
    "ent_s06c13ce14dec4986cd8b897ba4",
    "ent_s06c5b3dd97414f63db643bdd28",
    "ent_s06c65f4c0eebc6fd5eda537fee",
    "ent_s06d7c52acf1f76709d5966c750",
    "ent_s06e1ea503d23fb061066b8ec15",
    "ent_s06e88cd6c6be2ad9f3144c8648",
    "ent_s06f16a43f85c2c782e9dad622b",
    "ent_s06f88beed7c89ffc8c499c5dff",
    "ent_s06fa3bcfca5dd0d87693659567",
    "ent_s06fe6946ac4966c642848ceb9c"
  ],
  "safe_summary": "S06 source admission: 25 generic reward-item references and 29 typed quest reward links from retained licensed evidence. Original reward strings, quantities, dates, uncertainty and all prior canonical bytes are preserved. No effects, new evidence, collection, release or completed integration is asserted; S02 remains withheld.",
  "schema_version": "pywel.receipt.v1",
  "state": "accepted"
}
