{
  "created_at": "2026-09-11T03:01:46Z",
  "payload_hash_scope": "related_records_canonical_json",
  "payload_sha256": "e090c85a919f815c6b0bac061ae81468e4a8f2ba2bb99dd9845e3c2aba803e63",
  "receipt_id": "rcp_g02patchcatchup2026091001",
  "receipt_type": "contribution",
  "related_record_ids": [
    "evd_g02notice0730001",
    "evd_g02notice0740001",
    "evd_g02notice0750001",
    "evd_g02notice0800001",
    "evd_g02notice1090001",
    "evd_g02notice1100001",
    "evd_g02notice1110001",
    "evd_g02notice1120001",
    "evd_g02notice1140001",
    "evd_g02notice1150001",
    "evd_g02notice1160001",
    "evd_g02notice1170001",
    "evd_g02notice1190001",
    "evd_g02notice1200001",
    "evd_g02notice1230001",
    "evd_g02notice1260001",
    "evd_g02notice1270001",
    "evd_g02notice1280001",
    "pat_g02patch100030001",
    "pat_g02patch100040001",
    "pat_g02patch102000001",
    "pat_g02patch115000001",
    "pat_g02patch116000001",
    "pat_g02patch116010001",
    "pat_g02patch116020001",
    "pat_g02patch116030001",
    "pat_g02patch116040001",
    "pat_g02patch117000001",
    "pat_g02patch118000001",
    "pat_g02patch118010001",
    "pat_g02patch118020001",
    "pat_g02patch200000001",
    "pat_g02patch200010001",
    "pat_g02patch200020001",
    "pat_g02patch201000001"
  ],
  "safe_summary": "G02 indexes 17 missing version identities and 18 official notice locators. Distinct storefront notices, pending rollout limits and revised publication timestamps remain explicit. Zero gameplay claims, observations, supersessions or claim-review confirmations are added. The separate impact queue is triage, not accepted game knowledge.",
  "schema_version": "pywel.receipt.v1",
  "state": "accepted"
}
