{
  "created_at": "2026-09-12T23:42:17Z",
  "payload_hash_scope": "related_records_canonical_json",
  "payload_sha256": "bfe21804503f82007976c3c6b8b884ad929a915a34910acd8ee80e6ed3897477",
  "receipt_id": "rcp_s05questrewards2026091201",
  "receipt_type": "contribution",
  "related_record_ids": [
    "clm_s05190b5daedff95ba2f6b98ee7",
    "clm_s052b43cc5b0b5b3cc8a5d29881",
    "clm_s0542ac255b2ea060fa34523e2a",
    "clm_s05518650449bfbe4870353e8db",
    "clm_s0573dc987ebdf547ec777d9774",
    "clm_s058c7f6db955ff3a8985c216ad",
    "clm_s05986322bd1ff232d3b5e5c4a0",
    "clm_s05a5dc665be3a2a38381347882",
    "clm_s05b6785e5c3dabe17619d3c485",
    "clm_s05d45b18582d68c7eb4b564bc5",
    "clm_s05d50dc3687050971d4942ab67",
    "clm_s05f6df2b3b6ff0a956c17a8f1f"
  ],
  "safe_summary": "S05 reviewed offline normalization: 12 typed reward links across 10 existing quests using seven retained CrimsonWiki evidence records and existing item identities. All original strings, quantities, historical context and prior canonical bytes are preserved. No new prerequisites, source collection, independent corroboration, release or gameplay verification; S02 remains withheld. This receipt records source admission, not completed integration.",
  "schema_version": "pywel.receipt.v1",
  "state": "accepted"
}
