{
  "created_at": "2026-09-11T21:08:57Z",
  "payload_hash_scope": "related_records_canonical_json",
  "payload_sha256": "39ac6dae746052f3ec99900ef3431cb183c6ed8b2fcc6f32d0da4e92d61d4eff",
  "receipt_id": "rcp_s03recipeinputs2026091101",
  "receipt_type": "contribution",
  "related_record_ids": [
    "clm_s030926ac46992acde54e7f5c88",
    "clm_s0311379b7ba8c5f641ac18a4ea",
    "clm_s032131119c0c6a3d7f0de79033",
    "clm_s0323f36b1da813bc299f8023b1",
    "clm_s032b01384622aca03f59470ea6",
    "clm_s032b14f76bd68eaf51ba9b9994",
    "clm_s03332953e5be2ee9abaef47aa7",
    "clm_s03334159cdacf185fbc417df48",
    "clm_s0336db5ae1bb8eca50bf792cfd",
    "clm_s03406df24351ea054cd1dbdec5",
    "clm_s034ec171887dda18b46da47a5e",
    "clm_s03584e5577fdb975a917c7e2ef",
    "clm_s0359894ad6102a47a57342dda8",
    "clm_s035a5634eadd8def2052363189",
    "clm_s035d745389247d161f0af9cfa5",
    "clm_s035d8009386026f2246d8c8ecd",
    "clm_s036ba69a4c058b826118a5c54c",
    "clm_s0370dfc9fdd69c4329d3deb6d9",
    "clm_s037208c75ae5b5d76fe98a852c",
    "clm_s03794f1a07877871d4cae02ca1",
    "clm_s037bb44b39da17a5e207a6ede8",
    "clm_s0388456d7a620a5d1ea19e939a",
    "clm_s038c4763aa17bafc90534d391f",
    "clm_s0391c54f405f4bed326fe6264e",
    "clm_s039b415c5341d65af104773d98",
    "clm_s039f37f57c3589ec82bd676024",
    "clm_s03a00fccaad9e2366f02f453a6",
    "clm_s03ab3496e5b7e064a0c841dbf5",
    "clm_s03beb8cf8af804a668ec61baf7",
    "clm_s03c49d242526010d7ffe19e8c1",
    "clm_s03c9bc2000cefdc5632d38c401",
    "clm_s03d1426ecc9f7d397e280af4c3",
    "clm_s03d230c46bffd41aca20f292da",
    "clm_s03dbbd4694817bff4757264df1",
    "clm_s03dd6d9d910a444b202a6175f1",
    "clm_s03ec1df3561f7b3273992b5bb7",
    "ent_s03089f93124a24ccd5129cbd20",
    "ent_s031076662488cb15c6dd07183c",
    "ent_s03137356b7daee3ed71852c130",
    "ent_s0317d429230e465a246ccaf454",
    "ent_s031d2e5e8ac019b549a44aa03c",
    "ent_s03238fed15b8d8f96a483ecad6",
    "ent_s0326a5bec388ede4bc9432a030",
    "ent_s032918edbe11909697e6d301b0",
    "ent_s033608360d22137d115f4907ee",
    "ent_s0336552f8920e541a79f875ece",
    "ent_s0336b30e5fa7b90af69b7b3249",
    "ent_s03375205c169f9d7df035ab89b",
    "ent_s0341d0d35e0c0296303b53bba3",
    "ent_s036d0b6578619bc2e5c3ae47db",
    "ent_s03700416f71b2e78ba21cf4bf8",
    "ent_s03764218d38cdfc1246e41b96a",
    "ent_s03a11ab221daa573373176fcae",
    "ent_s03a807aef1ca3624d5d3993c8f",
    "ent_s03ab929b20e36553217f3ba6dd",
    "ent_s03b067d1e10cebfcdeb1136327",
    "ent_s03c495af6e1a006917f931baf3",
    "ent_s03c5b8acce23ec128ccb3d3416",
    "ent_s03d79a296f64b4639e54cbffb1",
    "ent_s03ee75e16e957347b2332231af",
    "ent_s03f8be2f45de62eec9e2a00d8f"
  ],
  "safe_summary": "S03 reviewed offline normalization of retained cooking/alchemy evidence: 25 ingredient identities and 36 typed links, including two recipe-target corrections. Original quantities, evidence timestamps, uncertainty and all prior canonical bytes are preserved. This receipt records source admission, not completed integration, publication, new collection or gameplay verification; S02 remains blocked.",
  "schema_version": "pywel.receipt.v1",
  "state": "accepted"
}
