{
  "created_at": "2026-09-10T21:37:47Z",
  "payload_hash_scope": "related_records_canonical_json",
  "payload_sha256": "00eaf4346b87e010dd28f425ef6c37df917a6ba213d45dc22ca2ff806f4ba36b",
  "receipt_id": "rcp_m8aprogression2026091001",
  "receipt_type": "contribution",
  "related_record_ids": [
    "clm_m8ahonoralliance2026091001",
    "clm_m8ahonorazurite2026091001",
    "clm_m8ahonorbloodstone2026091001",
    "clm_m8ahonorcontrib2026091001",
    "clm_m8ahonorearring2026091001",
    "clm_m8asealednoitem2026091001",
    "clm_m8asealedprereq2026091001",
    "clm_m8astolencontrib2026091001",
    "clm_m8astolendrill2026091001",
    "clm_m8astolenmap2026091001",
    "clm_m8astolenprereq2026091001",
    "clm_m8atrialcontrib2026091001",
    "clm_m8atrialentry2026091001",
    "evd_m8aconsolepulse2026091001",
    "evd_m8asealedguide2026091001",
    "evd_m8avulkk2026091001"
  ],
  "safe_summary": "M8A adds selected entry and reward facts for four existing House Roberts quests. Historical guide assertions only; PC-Steam pilot scope does not claim observed or current-build verification. Prior records remain unchanged; this receipt proves integrity only.",
  "schema_version": "pywel.receipt.v1",
  "state": "accepted"
}
