{
  "created_at": "2026-09-27T22:24:01Z",
  "payload_hash_scope": "related_records_canonical_json",
  "payload_sha256": "bdac41cf1262d7f0e4c8a33f3d045605bd589b8f829ebf8708d94c31cb2b304f",
  "receipt_id": "rcp_g04currentpatch2026092701",
  "receipt_type": "contribution",
  "related_record_ids": [
    "clm_g0424e6283745106bc0a4429b8f",
    "clm_g043e36d6b729e5481aaddf08d2",
    "clm_g04422cce1d215bd3c1bc0ce094",
    "clm_g0463ed73c85efb9ce4ed5b1d53",
    "clm_g046e24575629f8da1d9616354b",
    "clm_g046fa3b589facc6a370619f38d",
    "clm_g0474abb3f52bb1efdce6a68c30",
    "clm_g047c73f38ac69149ad21a167f9",
    "clm_g049d456c7a657d5247dd718e28",
    "clm_g04a5efe5d6aac0bbaa85354d9e",
    "clm_g04adec50865792b76bf7c01cbb",
    "clm_g04be1eb9563c6e7719b87561de",
    "clm_g04e9218068a0cd34b834753566",
    "clm_g04f0535d1a1339f30baad015ab",
    "clm_g04f2e83c49cbd616000a47b99f",
    "clm_g04fb83f0772a5aec341af0a5e2",
    "ent_g04176beca2b810cdc7bef168da",
    "ent_g0430a81ac6b0d1566a182b20c0",
    "ent_g0497cd3a0be6f8b2f6f436dd5a",
    "ent_g04a9908c8bf106561870af8545",
    "ent_g04b34d1c5c4f538f0331ae1ee0",
    "ent_g04d4c58f1434a3966c15d714a9",
    "evd_g04notice1300001",
    "evd_g04notice1310001",
    "evd_g04notice1320001",
    "evd_g04notice1330001",
    "pat_g04patch202000001",
    "pat_g04patch203000001",
    "pat_g04patch203010001",
    "pat_g04patch203020001"
  ],
  "safe_summary": "G04 reviewed official-publication selection: four patch identities through 2.03.02, four sources, six necessary subjects and sixteen publisher-intent claims. Prior canonical bytes and claim-review bounds remain unchanged. Rollout exclusions and incomplete gameplay coverage remain explicit. Admission is not completed integration, independent observation or a new release.",
  "schema_version": "pywel.receipt.v1",
  "state": "accepted"
}
