{
  "created_at": "2026-09-12T17:38:34Z",
  "payload_hash_scope": "related_records_canonical_json",
  "payload_sha256": "8e1d9eb4b5ce90b34c1deee5740100540f4a931b4608074e576e6b72ec7e46db",
  "receipt_id": "rcp_s04recipeoutputs2026091201",
  "receipt_type": "contribution",
  "related_record_ids": [
    "clm_s0404c71ab03869cf5e02b86b70",
    "clm_s040cd81313e9ffc2b1497a43b9",
    "clm_s04137819ccb333d4c299969bd7",
    "clm_s041442fec9f1c0e16215ac7af2",
    "clm_s04199f8a2489689a4134000c0d",
    "clm_s041fc73ede3fbe110117a0aaa9",
    "clm_s042491273234d7ceaba52cb865",
    "clm_s0424c9c8e7ec33d8a45f2caa69",
    "clm_s04299cfd68f6f09b21b722a97d",
    "clm_s042dbc749c73fb96455b549a8c",
    "clm_s042e44b2be1f0837e687b42b3f",
    "clm_s043e6062c0ea1397b5e74f6576",
    "clm_s0442c6311f91788fb92b61038b",
    "clm_s0445268db0c80363bd7df2ea4b",
    "clm_s0446328a4192a3d59f8371f93a",
    "clm_s044f592414e3061092365e25ef",
    "clm_s0457b4e6627e18cfb5f1f3d901",
    "clm_s04587de1f8b00c8f28361064e7",
    "clm_s045c8fa327b760e7c3fdc541cc",
    "clm_s0463bd0745af756ffb320b8953",
    "clm_s0463ed5dccc21f0f3d0c58f1f8",
    "clm_s047fbb4ab7f7bcfdd5a790a8c6",
    "clm_s048029b17646fe9939fcdb9d5f",
    "clm_s0484f98a15478567e2028672a4",
    "clm_s048871f915e10c7b2f67824f1b",
    "clm_s04937fb4d2e66fc1236da3de27",
    "clm_s0494748401e597386298b12018",
    "clm_s0497b7b3c6e93d3b31cc8db06d",
    "clm_s04aace118fa2d54a45154598a0",
    "clm_s04ac09b570881d865a11c696a5",
    "clm_s04ac0f79381d7a77cd1aa8e8dd",
    "clm_s04be0f07c22071b08e5bd04b59",
    "clm_s04bf486892aacc9be233f15cbb",
    "clm_s04d17810b8e4549e6384736d6a",
    "clm_s04d7937d5e075285e27e6e7dcd",
    "clm_s04da5c063e72f45a3d2709fc1b",
    "clm_s04dba85bfb556c8c96ed6a5dc2",
    "clm_s04e25571c96ff7ceeba7faf0db",
    "clm_s04e6032016d53f785f95cb9eff",
    "clm_s04ef4bcd3e7356e2a71fa92aff",
    "clm_s04fb47b7048c415f446963e37f",
    "ent_s0403540e451b77eb97fcba76c9",
    "ent_s0404eabe2b7e566d283ef373b3",
    "ent_s040fbfb8939f194e834584be78",
    "ent_s04137ae13f9144053350d44eaf",
    "ent_s04219f678d7bb3dd2a8fe0b9ae",
    "ent_s04361424a37fb1c85c2792925c",
    "ent_s043c7df0070eb08c0a435a6b40",
    "ent_s043d6054894e204b6a0a8ed531",
    "ent_s044127a8154022bff818bccf38",
    "ent_s0446d8c1559e7c657a549286ca",
    "ent_s04478cb762ce0c3eba4105e8ec",
    "ent_s044f00eff44ea879fcd646dd26",
    "ent_s044f28a330968ad6d7398a62b2",
    "ent_s0450efb5751c9b75251d909654",
    "ent_s0452bfc77363e564bb0f9077e2",
    "ent_s04622badb0232a18b5b41eb396",
    "ent_s046ccd2a6eb89ded75fde1be6d",
    "ent_s0470222920bf489799ff047956",
    "ent_s047b8aeb7bfc6a5f3652b96696",
    "ent_s04808af741f70eba5c968ac715",
    "ent_s048190caa7fe6ab880337e01ab",
    "ent_s0488f5b4131b7e5d8b0097ab4d",
    "ent_s048a6f2f7ada8277cfe52c717c",
    "ent_s049ddc62d324e6f0521505804e",
    "ent_s049fd4870d5596d1b776e329e6",
    "ent_s04a4b92f095f218605da85dd42",
    "ent_s04b86928068066865428c927c5",
    "ent_s04be08af771ed51d8ffb6964c0",
    "ent_s04c478da09096b9648e3ea18a1",
    "ent_s04c7b46088726fd5376836bfa1",
    "ent_s04c962a2d777375bf9adfa56fe",
    "ent_s04c98fe7170c74f3fe152ff92f",
    "ent_s04cb9a991c4a7a3b6df21d7589",
    "ent_s04cf6ac0a91195dd6d94218008",
    "ent_s04cfa9377d654a3c88d1e7c5b7",
    "ent_s04d79831d93a3e8b0e829ccdfa",
    "ent_s04eaf721ed4d5d3366d8771c01",
    "ent_s04f592db1dcaccf7c0cc1733b3",
    "ent_s04f5f995c85b4ef2faaf877534",
    "ent_s04faaa613f25eef4bde76da9e5",
    "ent_s04fc3403569b2dc749d93578f4"
  ],
  "safe_summary": "S04 reviewed offline normalization of retained recipe outputs: 41 named output identities and 41 typed links; five existing links reused without duplication. Original output strings, ingredient quantities, evidence dates, uncertainty and earlier canonical bytes remain unchanged. This records source admission, not completed integration, a new source capture, gameplay verification or a release. S02 remains withheld.",
  "schema_version": "pywel.receipt.v1",
  "state": "accepted"
}
